stock_id,name,產業,新聞
1476,儒鴻,儒鴻產業與產品定位待AI摘要補齊；請搭配年報、法說與產業資料更新護城河。,1476儒鴻-一股作氣很難嗎？-股市爆料同學會-CMoney；世足賽效應儒鴻、聚陽、遠東新都受惠-經濟日報；【即時…
1503,士電,士電產業與產品定位待AI摘要補齊；請搭配年報、法說與產業資料更新護城河。,輝達800V革命來了！士電與「這1檔」EPS飆高、提前卡位狂吃HVDC大商機訂單已滿到2029年-Yahoo股市；…
1513,中興電,中興電產業與產品定位待AI摘要補齊；請搭配年報、法說與產業資料更新護城河。,中興電營運創高，預期成長穩。-CMoney；黃仁勳示警缺電危機引發產業關注，華城、中興電等重電四雄與智慧電網相關供…
1514,亞力,亞力產業與產品定位待AI摘要補齊；請搭配年報、法說與產業資料更新護城河。,1514亞力-股市最新爆料，掌握股友們對眾個股股價、技術分析、新聞的第一手...-股市爆料同學會-CMoney；使…
1519,華城,華城產業與產品定位待AI摘要補齊；請搭配年報、法說與產業資料更新護城河。,使出十萬伏特！「這檔」累漲18.6%攜7檔飆漲停華城、士電、中興電、亞力訂單直達2028年-Yahoo股市；黃仁勳…
1560,中砂,中砂產業與產品定位待AI摘要補齊；請搭配年報、法說與產業資料更新護城河。,台燿(6274)--券商分點進出買賣統計-股市爆料同學會-CMoney；南亞科（2408）｜5月營收不如預期，營收…
1597,直得,直得產業與產品定位待AI摘要補齊；請搭配年報、法說與產業資料更新護城河。,訂單滿到2030年！「機器人這檔」觸漲停邁向連6紅東台翻黑亮綠燈、直得4檔重挫5%-Yahoo股市；1597直得-…
1727,中華化,中華化產業與產品定位待AI摘要補齊；請搭配年報、法說與產業資料更新護城河。,1727中華化-祝大家多空都賺錢-股市爆料同學會-CMoney；化工股轉身AI供應鏈！雙鍵、德淵等四檔亮燈中華化、…
1760,寶齡富錦,寶齡富錦產業與產品定位待AI摘要補齊；請搭配年報、法說與產業資料更新護城河。,寶齡富錦(1760)--券商分點進出買賣統計-股市爆料同學會-CMoney；台股大漲你獨賠？股市韭菜公開「死亡筆記…
1802,台玻,台玻產業與產品定位待AI摘要補齊；請搭配年報、法說與產業資料更新護城河。,玻璃股各類股一支獨秀！台玻漲逾4％專家憂短線已過熱-Yahoo股市；1802台玻-玻纖布缺到爆-股市爆料同學會-C…
2049,上銀,上銀產業與產品定位待AI摘要補齊；請搭配年報、法說與產業資料更新護城河。,上銀(2049)個股概覽|個股-股市-CMoney；上銀訂單暢旺交期拉長-UDN；盤中速報-上銀(2049)大跌7…
2059,川湖,川湖產業與產品定位待AI摘要補齊；請搭配年報、法說與產業資料更新護城河。,2059川湖-COMPUTEX熱潮點燃台股-股市爆料同學會-CMoney；處置股追蹤0526／今日新增10檔，國巨…
2233,宇隆,宇隆產業與產品定位待AI摘要補齊；請搭配年報、法說與產業資料更新護城河。,2233宇隆-脫離注意股了，可以上了-股市爆料同學會-CMoney；宇隆衝刺機器人報捷-經濟日報；〈COMPUTE…
2301,光寶科,光寶科產業與產品定位待AI摘要補齊；請搭配年報、法說與產業資料更新護城河。,黃仁勳兆元宴今登場！20檔概念股開紅花光寶科台達電4檔逆勢走弱-Yahoo股市；6月絕地大反攻，這些股票為何狂漲？…
2308,台達電,台達電產業與產品定位待AI摘要補齊；請搭配年報、法說與產業資料更新護城河。,黃仁勳一句話助陣？台達電亮燈飆2585元新天價市值挑戰7兆元-Yahoo股市；2308台達電-今天拉漲停-股市爆料…
2313,華通,華通產業與產品定位待AI摘要補齊；請搭配年報、法說與產業資料更新護城河。,不只華通要飆！「這4檔低軌衛星」受惠SpaceX狂吞730億美元級國防大單「零紅鏈」要求全面啟動-Yahoo股市；…
2317,鴻海,鴻海產業與產品定位待AI摘要補齊；請搭配年報、法說與產業資料更新護城河。,今日漲停股｜AI伺服器與面板雙引擎齊發，鴻海、廣達、群創領銜台股強勢攻頂0529｜豐雲學堂2026年06月-sin…
2327,國巨*,國巨*產業與產品定位待AI摘要補齊；請搭配年報、法說與產業資料更新護城河。,【台股5月風雲榜】國巨華新科「被動元件七雄」齊飛天禾伸堂狂飆逾200%稱王-Yahoo股市；處置股追蹤0526／今…
2360,致茂,致茂產業與產品定位待AI摘要補齊；請搭配年報、法說與產業資料更新護城河。,台積電2360元天價曇花一現！尾盤爆4703張大單還是跌5元-Yahoo股市；〈台股風向球〉直攻4萬5黃仁勳旋風燃…
2368,金像電,金像電產業與產品定位待AI摘要補齊；請搭配年報、法說與產業資料更新護城河。,金像電(2368)個股概覽|個股-股市-CMoney；6／3盤中熱門焦點股-證券-工商時報；主動式ETF大換股！不…
2382,廣達,廣達產業與產品定位待AI摘要補齊；請搭配年報、法說與產業資料更新護城河。,【Hot台股】廣達緯創4檔「電子五哥」滿血復活飆漲停！網喊「最後一名是誰很明顯XD」分析師：黃仁勳光環加持-Yah…
2383,台光電,台光電產業與產品定位待AI摘要補齊；請搭配年報、法說與產業資料更新護城河。,台光電(2383)今日股價與討論-股市爆料同學會-CMoney；PCB族群全瘋了！台光電滿產能狂衝、景碩砸235億…
2402,毅嘉,毅嘉產業與產品定位待AI摘要補齊；請搭配年報、法說與產業資料更新護城河。,有神秘力量進場了!-CMoney；2402毅嘉-好事總是多磨持續加碼-股市爆料同學會-CMoney；2402毅嘉-…
2404,漢唐,漢唐產業與產品定位待AI摘要補齊；請搭配年報、法說與產業資料更新護城河。,2404漢唐-惠利1994年6月9日出生，所以目標在惠利生日前股價達到1...-股市爆料同學會-CMoney；外資…
2449,京元電子,京元電子產業與產品定位待AI摘要補齊；請搭配年報、法說與產業資料更新護城河。,2449京元電子-散戶愛看新聞做股票，我就給你新聞-股市爆料同學會-CMoney；半導體封測產業是做什麼的？日月光…
2454,聯發科,聯發科產業與產品定位待AI摘要補齊；請搭配年報、法說與產業資料更新護城河。,【Hot台股】聯發科5000元近關情怯...網哭「發哥晶片都秀出來了」分析師：平常心看待-Yahoo股市；創意(3…
2455,全新,全新產業與產品定位待AI摘要補齊；請搭配年報、法說與產業資料更新護城河。,台股短線恐陷入修正?主動式ETF怎麼挑?艾綸點名下半年產業趨勢!|《雅筑會客室》EP33｜劉育綸、張雅筑-sino…
2467,志聖,志聖產業與產品定位待AI摘要補齊；請搭配年報、法說與產業資料更新護城河。,玻璃基板是什麼？概念股有哪些？台灣供應鏈、量產時程一次看-商周；2467志聖-G2C-股市爆料同學會-CMoney…
2481,強茂,強茂產業與產品定位待AI摘要補齊；請搭配年報、法說與產業資料更新護城河。,2481強茂-股市最新爆料，掌握股友們對眾個股股價、技術分析、新聞的第一手...-股市爆料同學會-CMoney；南…
2486,一詮,一詮產業與產品定位待AI摘要補齊；請搭配年報、法說與產業資料更新護城河。,光電全面爆發！「這檔」連10漲131%領友達、一詮、錸德等8檔漲停群創、國碩齊攻5%-Yahoo股市；【0602台…
2912,統一超,統一超產業與產品定位待AI摘要補齊；請搭配年報、法說與產業資料更新護城河。,慘淪台股盤面犧牲品？「這檔大咖股」慘崩6日淪弱勢股王董事坦言：產業加速淘汰中-Yahoo股市；【0602台股盤前】…
3008,大立光,大立光產業與產品定位待AI摘要補齊；請搭配年報、法說與產業資料更新護城河。,大立光(3008)股價創5年新高，連創辦人林家都出手買自家股票，可以跟著進場？揭開老股王轉型密碼-今周刊；〈財經週…
3013,晟銘電,晟銘電產業與產品定位待AI摘要補齊；請搭配年報、法說與產業資料更新護城河。,AI爆發「伺服器機殼廠」今爆量強攻準漲停！總經理親曝「生意還不錯」樂觀看下半年-Yahoo股市；3013晟銘電-套…
3017,奇鋐,奇鋐產業與產品定位待AI摘要補齊；請搭配年報、法說與產業資料更新護城河。,Computex2026散熱液冷商機爆發，奇鋐、雙鴻、台達電指標股全面迎戰AI升級潮｜股市話題｜豐雲學堂2026年…
3023,信邦,信邦產業與產品定位待AI摘要補齊；請搭配年報、法說與產業資料更新護城河。,"【0604台股盤前】土洋連四買加權飆破46,400新高！重電與證券接棒強攻，「月營收創12個月新高」:南亞科、信邦…"
3035,智原,智原產業與產品定位待AI摘要補齊；請搭配年報、法說與產業資料更新護城河。,【0602台股盤前】COMPUTEX今日開展，輝達、高通背板效應引爆，Computex強勢概念股:景碩(3189)…
3037,欣興,欣興產業與產品定位待AI摘要補齊；請搭配年報、法說與產業資料更新護城河。,良率95%、成本砍半、AMD百億押注...台灣IC載板廠憑什麼吃到EFB這波？｜股市話題｜豐雲學堂2026年06月…
3042,晶技,晶技產業與產品定位待AI摘要補齊；請搭配年報、法說與產業資料更新護城河。,晶技：高階應用供不應求；中低階價格止跌-Yahoo股市；3042晶技-投信買7100張嚇死人了-股市爆料同學會-C…
3044,健鼎,健鼎產業與產品定位待AI摘要補齊；請搭配年報、法說與產業資料更新護城河。,良率95%、成本砍半、AMD百億押注...台灣IC載板廠憑什麼吃到EFB這波？｜股市話題｜豐雲學堂2026年06月…
3081,聯亞,聯亞產業與產品定位待AI摘要補齊；請搭配年報、法說與產業資料更新護城河。,黃仁勳「兆元論」帶飛光通訊！邁威爾夜飆32%波若威聯亞光聖全亮燈-Yahoo股市；矽光子強勢回歸！黃仁勳談「銅光並…
3131,弘塑,弘塑產業與產品定位待AI摘要補齊；請搭配年報、法說與產業資料更新護城河。,"【0527台股盤前】台股衝44,000爆1.5兆天量洗盤！MOSFET、固態電容強攻接棒，「投本比排行」:晶技、惠…"
3163,波若威,波若威產業與產品定位待AI摘要補齊；請搭配年報、法說與產業資料更新護城河。,黃仁勳「兆元論」帶飛光通訊！邁威爾夜飆32%波若威聯亞光聖全亮燈-Yahoo股市；【3163波若威】法說重點：CP…
3167,大量,大量產業與產品定位待AI摘要補齊；請搭配年報、法說與產業資料更新護城河。,處置股追蹤0526／今日新增10檔，國巨、大毅、昇達科首入列，禾伸堂、大量再遭二度處置｜股市話題-sinotrad…
3189,景碩,景碩產業與產品定位待AI摘要補齊；請搭配年報、法說與產業資料更新護城河。,【0602台股盤前】COMPUTEX今日開展，輝達、高通背板效應引爆，Computex強勢概念股:景碩(3189)…
3231,緯創,緯創產業與產品定位待AI摘要補齊；請搭配年報、法說與產業資料更新護城河。,【Hot台股】廣達緯創4檔「電子五哥」滿血復活飆漲停！網喊「最後一名是誰很明顯XD」分析師：黃仁勳光環加持-Yah…
3234,光環,光環產業與產品定位待AI摘要補齊；請搭配年報、法說與產業資料更新護城河。,【Hot台股】廣達緯創4檔「電子五哥」滿血復活飆漲停！網喊「最後一名是誰很明顯XD」分析師：黃仁勳光環加持-Yah…
3264,欣銓,欣銓產業與產品定位待AI摘要補齊；請搭配年報、法說與產業資料更新護城河。,3264欣銓-股市最新爆料，掌握股友們對眾個股股價、技術分析、新聞的第一手...-股市爆料同學會-CMoney；欣…
3265,台星科,台星科產業與產品定位待AI摘要補齊；請搭配年報、法說與產業資料更新護城河。,封測族群超旺！「這檔」週拉3根挾力成、南茂漲停創高華東連6漲破40%、台星科寫新天價-Yahoo股市；3265台星…
3289,宜特,宜特產業與產品定位待AI摘要補齊；請搭配年報、法說與產業資料更新護城河。,宜特(3289)--券商分點進出買賣統計-股市爆料同學會-CMoney；台股午盤震盪大跌逾400點台積電跌20元-…
3324,雙鴻,雙鴻產業與產品定位待AI摘要補齊；請搭配年報、法說與產業資料更新護城河。,Computex2026散熱液冷商機爆發，奇鋐、雙鴻、台達電指標股全面迎戰AI升級潮｜股市話題｜豐雲學堂2026年…
3363,上詮,上詮產業與產品定位待AI摘要補齊；請搭配年報、法說與產業資料更新護城河。,台積電點火CPO元年！光通訊廠上詮「砸重金擴產搶商機」3.2T產品下半年出貨、6.4T明年接棒-Yahoo股市；3…
3374,精材,精材產業與產品定位待AI摘要補齊；請搭配年報、法說與產業資料更新護城河。,精材通過配息2.5元；測試代工成主要動能-Yahoo股市；去年EPS估4.8元今年逾6.5，被低估的台積電大聯盟股…
3443,創意,創意產業與產品定位待AI摘要補齊；請搭配年報、法說與產業資料更新護城河。,創意(3443)、聯發科(2454)，GoogleASIC雙線開花，雲端轉骨故事的台股雙主角｜產業熱話｜豐雲學堂2…
3450,聯鈞,聯鈞產業與產品定位待AI摘要補齊；請搭配年報、法說與產業資料更新護城河。,3450聯鈞-今日醜到爆的k棒-股市爆料同學會-CMoney；處置股追蹤0526／今日新增10檔，國巨、大毅、昇達…
3481,群創,群創產業與產品定位待AI摘要補齊；請搭配年報、法說與產業資料更新護城河。,群創60元只差臨門一腳面板雙虎奪台股成交量冠亞軍-Yahoo股市；面板擺脫循環宿命？群創、友達轉攻AI先進封裝，技…
3491,昇達科,昇達科產業與產品定位待AI摘要補齊；請搭配年報、法說與產業資料更新護城河。,處置股追蹤0526／今日新增10檔，國巨、大毅、昇達科首入列，禾伸堂、大量再遭二度處置｜股市話題-sinotrad…
3529,力旺,力旺產業與產品定位待AI摘要補齊；請搭配年報、法說與產業資料更新護城河。,千金股解密—力旺3529-自由時報；3529力旺-拒絕恐懼，學會擁抱股價的呼吸-股市爆料同學會-CMoney；台股…
3563,牧德,牧德產業與產品定位待AI摘要補齊；請搭配年報、法說與產業資料更新護城河。,AOI設備廠牧德5月營收3.49億元續創新高年增6.97%-news.cnyes.com；3563牧德-牧德成交疲…
3583,辛耘,辛耘產業與產品定位待AI摘要補齊；請搭配年報、法說與產業資料更新護城河。,辛耘(3583)--券商分點進出買賣統計-股市爆料同學會-CMoney；【00992A】05/29操作日報｜狂敲辛…
3587,閎康,閎康產業與產品定位待AI摘要補齊；請搭配年報、法說與產業資料更新護城河。,電子股五窮六絕效應不明顯法人喊買這幾檔股票-經濟日報；3587閎康-有紅都是送分題-股市爆料同學會-CMoney；…
3605,宏致,宏致產業與產品定位待AI摘要補齊；請搭配年報、法說與產業資料更新護城河。,快抱不住-CMoney；3605宏致-股市最新爆料，掌握股友們對眾個股股價、技術分析、新聞的第一手...-股市爆料…
3645,達邁,達邁產業與產品定位待AI摘要補齊；請搭配年報、法說與產業資料更新護城河。,達邁(3645)--券商分點進出買賣統計-股市爆料同學會-CMoney；3645達邁-是精材還是富采-股市爆料同學…
3653,健策,健策產業與產品定位待AI摘要補齊；請搭配年報、法說與產業資料更新護城河。,【台股5月風雲榜】腳踝斬！森崴能源苦吞11根跌停崩跌逾7成散熱股王健策挫逾3成千金光環失色-Yahoo股市；365…
3661,世芯-KY,世芯-KY產業與產品定位待AI摘要補齊；請搭配年報、法說與產業資料更新護城河。,3661世芯-KY-高通亞馬遜大跌我就不相信世芯不會跌停-股市爆料同學會-CMoney；千金股解密—世芯-KY36…
3665,貿聯-KY,貿聯-KY產業與產品定位待AI摘要補齊；請搭配年報、法說與產業資料更新護城河。,貿聯-KY(3665)個股概覽|個股-股市-CMoney；處置股追蹤0526／今日新增10檔，國巨、大毅、昇達科首…
3680,家登,家登產業與產品定位待AI摘要補齊；請搭配年報、法說與產業資料更新護城河。,3680家登-546開空2張-股市爆料同學會-CMoney；家登高層人事異動強化拓展美國市場-自由時報；Gogor…
3701,大眾控,大眾控產業與產品定位待AI摘要補齊；請搭配年報、法說與產業資料更新護城河。,3701大眾控是:台股最後一檔實現財富自由的低價翻身股-CMoney；3701大眾控-低接買等每張股票賺超過10萬…
3711,日月光投控,日月光投控產業與產品定位待AI摘要補齊；請搭配年報、法說與產業資料更新護城河。,外資大量賣超，日月光投控股價承壓-CMoney；半導體封測產業是做什麼的？日月光、力成等指標股在產能告急下的獲利爆…
3715,定穎投控,定穎投控產業與產品定位待AI摘要補齊；請搭配年報、法說與產業資料更新護城河。,3715定穎投控-這個量搞的好像你也被關起來一樣暈倒-股市爆料同學會-CMoney；3715定穎投控-大盤翻黑了又…
4746,台耀,台耀產業與產品定位待AI摘要補齊；請搭配年報、法說與產業資料更新護城河。,「這1檔ETF」漲幅高達79％！專家驚：比詐騙集團還猛-Yahoo股市；冷門ETF黑馬是它！績效1382%贏台股大…
4749,新應材,新應材產業與產品定位待AI摘要補齊；請搭配年報、法說與產業資料更新護城河。,4749新應材-主力這麼厲害的嗎來回洗-股市爆料同學會-CMoney；特化材料族群短期迎毛利逆風法人持續看好這幾檔…
4772,台特化,台特化產業與產品定位待AI摘要補齊；請搭配年報、法說與產業資料更新護城河。,4772台特化-台特法說會簡報-股市爆料同學會-CMoney；4772台特化-結果除了台特化其他一線都被升評了？🤔…
4958,臻鼎-KY,臻鼎-KY產業與產品定位待AI摘要補齊；請搭配年報、法說與產業資料更新護城河。,又有15檔台股被「關禁閉」！PCB「這2檔」被關被動元件獄友再添3名-Yahoo股市；「圈存」其實就是多一套手續，…
4971,IET-KY,IET-KY產業與產品定位待AI摘要補齊；請搭配年報、法說與產業資料更新護城河。,4971IET-KY-狗欄杆-股市爆料同學會-CMoney；光聖、IET強強聯手加速搶攻CPO市場-經濟日報；焦點…
4977,眾達-KY,眾達-KY產業與產品定位待AI摘要補齊；請搭配年報、法說與產業資料更新護城河。,眾達-KY(4977)--券商分點進出買賣統計-股市爆料同學會-CMoney；美股法說CRDO｜Credo營收暴衝…
4979,華星光,華星光產業與產品定位待AI摘要補齊；請搭配年報、法說與產業資料更新護城河。,4979華星光-今天雲霄飛車唷抱好了-股市爆料同學會-CMoney；台股沖天炮攻破46000大關！今起「這3檔」強…
4991,環宇-KY,環宇-KY產業與產品定位待AI摘要補齊；請搭配年報、法說與產業資料更新護城河。,4991環宇-KY-又下來跟兄弟倆團聚了-股市爆料同學會-CMoney；《台北股市》注意股：3日62檔國巨*.南亞…
5274,信驊,信驊產業與產品定位待AI摘要補齊；請搭配年報、法說與產業資料更新護城河。,"股王目標價再飆新天價！大摩喊信驊23,456元「同花順價」下一代晶片成最大王牌-Yahoo股市；股王新天價1》大摩…"
5289,宜鼎,宜鼎產業與產品定位待AI摘要補齊；請搭配年報、法說與產業資料更新護城河。,AI全面噴發！「這檔」連3漲24.5%攜廣達、訊芯等10檔漲停緯創、宜鼎、研華締新猷-Yahoo股市；宜鼎看DRA…
5347,世界,世界產業與產品定位待AI摘要補齊；請搭配年報、法說與產業資料更新護城河。,台股市值「登世界第5大」！外媒驚喜點名背後關鍵功臣-Yahoo股市；歷史性一刻！台灣股市首度超車印度登世界第5、外…
5443,均豪,均豪產業與產品定位待AI摘要補齊；請搭配年報、法說與產業資料更新護城河。,均豪(5443)--券商分點進出買賣統計-股市爆料同學會-CMoney；籌碼咖孔明-鉅亨號；5443均豪-漲-股市…
5536,聖暉*,聖暉*產業與產品定位待AI摘要補齊；請搭配年報、法說與產業資料更新護城河。,5536聖暉*-聖暉股友午安連跌二天心情一定很煩躁沒辦法大盤大跌...-股市爆料同學會-CMoney；聖暉通過配息…
6005,群益證,群益證產業與產品定位待AI摘要補齊；請搭配年報、法說與產業資料更新護城河。,台股漲多怕了嗎？群益證總座李文柱：基本面撐腰、ETF坐鎮，這波行情和以前不一樣！-商周財富網；群益證股東會／董事長…
6139,亞翔,亞翔產業與產品定位待AI摘要補齊；請搭配年報、法說與產業資料更新護城河。,〈財經週報-台股熱點〉AI擴產潮帶動無塵室工程大爆發-自由時報；亞翔(6139)個股概覽|個股-股市-CMoney…
6187,萬潤,萬潤產業與產品定位待AI摘要補齊；請搭配年報、法說與產業資料更新護城河。,萬潤(6187)個股概覽|個股-股市-CMoney；台股盤中大跳水878點！56檔飆股維持漲停撐盤「這檔矽晶圓」訂…
6196,帆宣,帆宣產業與產品定位待AI摘要補齊；請搭配年報、法說與產業資料更新護城河。,帆宣通過配息6.5元；今年營運看成長-Yahoo股市；6196帆宣-籌碼不差被氣氛錯殺買個機會-股市爆料同學會-C…
6197,佳必琪,佳必琪產業與產品定位待AI摘要補齊；請搭配年報、法說與產業資料更新護城河。,6197佳必琪-Q2再超越Q1的毛利率35.77，淨利率20.24%-股市爆料同學會-CMoney；6197佳必琪…
6213,聯茂,聯茂產業與產品定位待AI摘要補齊；請搭配年報、法說與產業資料更新護城河。,PCB還在飆！「這檔」連拉2根帶金居、聯茂、德宏漲停臻鼎、台燿、景碩全寫新天價-Yahoo股市；漲價效應發威法人調…
6217,中探針,中探針產業與產品定位待AI摘要補齊；請搭配年報、法說與產業資料更新護城河。,6217中探針-木馬今天沒出現？-股市爆料同學會-CMoney；處置股名單0602／今日新增10檔，力積電、麗正、…
6223,旺矽,旺矽產業與產品定位待AI摘要補齊；請搭配年報、法說與產業資料更新護城河。,"6223旺矽-旺矽搭AI發展順風車-股市爆料同學會-CMoney；台股新貴族！穎崴登5,000元股后一表看懂探針卡…"
6243,迅杰,迅杰產業與產品定位待AI摘要補齊；請搭配年報、法說與產業資料更新護城河。,"股市爆料同學會-CMoney；Itron副總裁兼首席會計官DavidWright出售價值6,243美元的股票-In…"
6257,矽格,矽格產業與產品定位待AI摘要補齊；請搭配年報、法說與產業資料更新護城河。,6257矽格-這支很髒-股市爆料同學會-CMoney；Q1營收年增22%、獲利竟能年增65%，這檔挾高階CCL及低…
6274,台燿,台燿產業與產品定位待AI摘要補齊；請搭配年報、法說與產業資料更新護城河。,台燿(6274)--券商分點進出買賣統計-股市爆料同學會-CMoney；PCB還在飆！「這檔」連拉2根帶金居、聯茂…
6278,台表科,台表科產業與產品定位待AI摘要補齊；請搭配年報、法說與產業資料更新護城河。,慘淪AI盤面犧牲品？「這檔穩健股」股價竟回落近3成…連崩6天登弱勢股王網哀：不把錢丟進傳產-Yahoo股市；627…
6282,康舒,康舒產業與產品定位待AI摘要補齊；請搭配年報、法說與產業資料更新護城河。,低軌衛星一片紅！「這檔」連4漲24.6%領群創、康舒漲停國巨、事欣科、聯發科都飆破5%-Yahoo股市；6282康…
6285,啟碁,啟碁產業與產品定位待AI摘要補齊；請搭配年報、法說與產業資料更新護城河。,記憶體、低軌衛星殺不住！旺宏暴衝185.59%、啟碁也飆208.21%57檔注意股出列-Yahoo股市；低軌衛星概…
6412,群電,群電產業與產品定位待AI摘要補齊；請搭配年報、法說與產業資料更新護城河。,「AMD點名封測廠」、代工二哥慘被踢出！00919換股大地震18進18出「兆元宴」這檔卻入列-Yahoo股市；23…
6414,樺漢,樺漢產業與產品定位待AI摘要補齊；請搭配年報、法說與產業資料更新護城河。,6414樺漢-價值重估最終章-股市爆料同學會-CMoney；樺漢深化與子公司Kontron合作持股比擬提升至30%…
6442,光聖,光聖產業與產品定位待AI摘要補齊；請搭配年報、法說與產業資料更新護城河。,黃仁勳「兆元論」帶飛光通訊！邁威爾夜飆32%波若威聯亞光聖全亮燈-Yahoo股市；矽光子強勢回歸！黃仁勳談「銅光並…
6451,訊芯-KY,訊芯-KY產業與產品定位待AI摘要補齊；請搭配年報、法說與產業資料更新護城河。,4月營收連2月月增法人看好訊芯-KY今年EPS年增率可達660%以上！-理財周刊；6451訊芯-KY-今天會了結一…
