stock_id,name,產業,新聞
6510,精測,精測產業與產品定位待AI摘要補齊；請搭配年報、法說與產業資料更新護城河。,精測(6510)個股概覽|個股-股市-CMoney；精測擴產搶AI商機-經濟日報；遭酸賣飛不忍了！阮慕驊公開「超狂…
6515,穎崴,穎崴產業與產品定位待AI摘要補齊；請搭配年報、法說與產業資料更新護城河。,"台股新貴族！穎崴登5,000元股后一表看懂探針卡三雄蛇年誰最猛？-經濟日報；6515穎崴-那麼多股選上了這個，唉-…"
6526,達發,達發產業與產品定位待AI摘要補齊；請搭配年報、法說與產業資料更新護城河。,營收獲利速報》達發去年EPS17.32元擬配息13.5元-自由時報；達發股東會／通過每股配息13.5元10G-PO…
6531,愛普*,愛普*產業與產品定位待AI摘要補齊；請搭配年報、法說與產業資料更新護城河。,【0601台股盤前】加權指數再創1.87兆新高天量!!!戴爾Q1財報引爆老AI漲停，『多頭趨勢實戶買』:微星(23…
6640,均華,均華產業與產品定位待AI摘要補齊；請搭配年報、法說與產業資料更新護城河。,致茂、均華...台積電布局次世代封裝「CoPoS」，3台廠吃下雙重商機-烱叔台股攻略-台股-商周財富網；股市爆料同…
6643,M31,M31產業與產品定位待AI摘要補齊；請搭配年報、法說與產業資料更新護城河。,6643M31-IC設計股隨聯發科攀升-股市爆料同學會-CMoney；高通公布21家台灣供應鏈背板，Compute…
6664,群翊,群翊產業與產品定位待AI摘要補齊；請搭配年報、法說與產業資料更新護城河。,群翊(6664)董監事與大股東持股申報轉讓查詢-股市爆料同學會-CMoney；玻璃基板是什麼？概念股有哪些？台灣供…
6669,緯穎,緯穎產業與產品定位待AI摘要補齊；請搭配年報、法說與產業資料更新護城河。,6669緯穎-到底什麼時候要上6000-股市爆料同學會-CMoney；證交所與緯穎接受彭博專訪聚焦COMPUTEX…
6672,騰輝電子-KY,騰輝電子-KY產業與產品定位待AI摘要補齊；請搭配年報、法說與產業資料更新護城河。,騰輝電子-KY(6672)--券商分點進出買賣統計-股市爆料同學會-CMoney；【營收快訊】騰輝電子-KY(66…
6683,雍智科技,雍智科技產業與產品定位待AI摘要補齊；請搭配年報、法說與產業資料更新護城河。,"6683雍智科技-下午好外資:-211,222股投信:0股自營:+1...-股市爆料同學會-CMoney；焦點股》…"
6691,洋基工程,洋基工程產業與產品定位待AI摘要補齊；請搭配年報、法說與產業資料更新護城河。,6691洋基工程-看來股東會前景堪憂？-股市爆料同學會-CMoney；洋基工程通過股利22元；今年營收看增6~7成…
6693,廣閎科,廣閎科產業與產品定位待AI摘要補齊；請搭配年報、法說與產業資料更新護城河。,6693廣閎科-不好意思.....-股市爆料同學會-CMoney；6693廣閎科-總算要花開了！🚀🚀🚀-股市爆料同…
6789,采鈺,采鈺產業與產品定位待AI摘要補齊；請搭配年報、法說與產業資料更新護城河。,6789采鈺-利多不漲反跌-股市爆料同學會-CMoney；采鈺通過配息3元；AI布局添成長動能-Yahoo股市；【…
6805,富世達,富世達產業與產品定位待AI摘要補齊；請搭配年報、法說與產業資料更新護城河。,黃仁勳開講漲一波！散熱族群4檔走揚富世達亮燈漲停分析師曝仍有1隱憂-Yahoo股市；【0603台股盤前】COMPU…
6940,格斯科技*,格斯科技*產業與產品定位待AI摘要補齊；請搭配年報、法說與產業資料更新護城河。,6940格斯科技*-有什麼消息嗎？-股市爆料同學會-CMoney；格斯科技首次進軍COMPUTEX盛會展出AIDC…
7711,永擎,永擎產業與產品定位待AI摘要補齊；請搭配年報、法說與產業資料更新護城河。,永擎(7711)--券商分點進出買賣統計-股市爆料同學會-CMoney；永擎電子上市滿半年證交所：明起可融資融券-…
7717,萊德光電-KY,萊德光電-KY產業與產品定位待AI摘要補齊；請搭配年報、法說與產業資料更新護城河。,飆股幕後》衛星題材衝天萊德光電近5月漲11倍-自由時報；萊德光電-KY客戶驗證告捷，全年看旺、下半年更強-Yaho…
7734,印能科技,印能科技產業與產品定位待AI摘要補齊；請搭配年報、法說與產業資料更新護城河。,印能科技(7734)--券商分點進出買賣統計-股市爆料同學會-CMoney；致茂、均華...台積電布局次世代封裝「…
7769,鴻勁,鴻勁產業與產品定位待AI摘要補齊；請搭配年報、法說與產業資料更新護城河。,中華電小金雞、鴻勁上市滿半年證交所：6/3開始融資融券-Yahoo股市；7769鴻勁-目前不該賣出的幾個理由-股市…
7792,安葆,安葆產業與產品定位待AI摘要補齊；請搭配年報、法說與產業資料更新護城河。,AI資料中心基建需求強安葆在手訂單逾120億元-news.cnyes.com；安葆訂單看到2028年-UDN；安葆…
7828,創新服務,創新服務產業與產品定位待AI摘要補齊；請搭配年報、法說與產業資料更新護城河。,7828創新服務何時解除注意股~-CMoney；台股10檔被「關禁閉」！全關到6/12這3檔每20分鐘撮合一次-T…
7856,漢測,漢測產業與產品定位待AI摘要補齊；請搭配年報、法說與產業資料更新護城河。,7856漢測-漢測真令人失望-股市爆料同學會-CMoney；台股創高在前！探針卡三雄齊刷天價還有兩檔「隱形冠軍」寫…
7899,景美,景美產業與產品定位待AI摘要補齊；請搭配年報、法說與產業資料更新護城河。,股市爆料同學會-CMoney；群創今年狂漲229%爆「百萬成交量」稱霸！友達強鎖漲停-TVBS新聞網；7899景美…
8021,尖點,尖點產業與產品定位待AI摘要補齊；請搭配年報、法說與產業資料更新護城河。,處置股追蹤0526／今日新增10檔，國巨、大毅、昇達科首入列，禾伸堂、大量再遭二度處置｜股市話題-sinotrad…
8027,鈦昇,鈦昇產業與產品定位待AI摘要補齊；請搭配年報、法說與產業資料更新護城河。,處置股名單0525／今日新增9檔，聯友金屬、鈦昇、尚茂二度入列，再增麗嬰房、倉和、美而快，近期出關個股一文掌握｜股…
8028,昇陽半導體,昇陽半導體產業與產品定位待AI摘要補齊；請搭配年報、法說與產業資料更新護城河。,先進材料解決方案具想像空間法人大升昇陽半導體目標價-UDN；8028昇陽半導體-營收連5年創高跟客戶前進美國製造法…
8046,南電,南電產業與產品定位待AI摘要補齊；請搭配年報、法說與產業資料更新護城河。,南亞兩考量賣南電、南亞科股-UDN；良率95%、成本砍半、AMD百億押注...台灣IC載板廠憑什麼吃到EFB這波？…
8155,博智,博智產業與產品定位待AI摘要補齊；請搭配年報、法說與產業資料更新護城河。,8155博智-Dell都噴發台灣最純的戴爾概念股好歹也動動-股市爆料同學會-CMoney；【06/02產業即時新聞…
8299,群聯,群聯產業與產品定位待AI摘要補齊；請搭配年報、法說與產業資料更新護城河。,"創新高！群聯5月營收228億元年增300%-Yahoo股市；【0604台股盤前】土洋連四買加權飆破46,400新高…"
8358,金居,金居產業與產品定位待AI摘要補齊；請搭配年報、法說與產業資料更新護城河。,PCB還在飆！「這檔」連拉2根帶金居、聯茂、德宏漲停臻鼎、台燿、景碩全寫新天價-Yahoo股市；聯電(2303)、…
8996,高力,高力產業與產品定位待AI摘要補齊；請搭配年報、法說與產業資料更新護城河。,8996高力-最近高力表現不好，是個尋找買點的機會，仍然看好-股市爆料同學會-CMoney；《價值型投資最新產業研…
